{
  "schema_version": "1.0",
  "song_title": "夜曲",
  "artist": "周杰伦",
  "total_duration_seconds": 245,
  "bpm": 72,
  "time_signature": "4/4",
  "key": "F minor",
  "mood_arc": ["atmospheric", "melancholy", "building", "passionate", "tender", "passionate", "reflective"],
  "energy_arc": ["low", "medium_low", "medium", "high", "medium_low", "high", "medium"],
  "analysis_method": "lrc_parse",
  "analysis_notes": "Structure inferred from LRC timestamps and lyric repetition patterns. BPM estimated from verse pacing.",
  "sections": [
    {
      "section_id": "intro",
      "section_type": "intro",
      "section_label": "Intro",
      "start_time": 0.0,
      "end_time": 15.2,
      "duration_seconds": 15.2,
      "start_beat": 1,
      "end_beat": 18,
      "mood": "atmospheric",
      "energy_level": "low",
      "lyrics_line_refs": [],
      "lyrics_summary": null,
      "visual_suggestion": "Slow establishing shot of a rain-soaked city at night, neon reflections on wet pavement",
      "transition_to_next": "Dissolve from wide city to close-up of protagonist"
    },
    {
      "section_id": "verse_1",
      "section_type": "verse",
      "section_label": "Verse 1",
      "start_time": 15.2,
      "end_time": 45.8,
      "duration_seconds": 30.6,
      "start_beat": 19,
      "end_beat": 54,
      "mood": "melancholy",
      "energy_level": "medium_low",
      "lyrics_line_refs": ["line_01", "line_02", "line_03", "line_04"],
      "lyrics_summary": "The protagonist recalls a lost relationship, walking through familiar places alone at night.",
      "visual_suggestion": "Intimate close-ups and medium shots, protagonist walking through dimly lit streets, intercut with memory fragments",
      "transition_to_next": "Accelerating cuts as emotional intensity builds toward pre-chorus"
    },
    {
      "section_id": "pre_chorus_1",
      "section_type": "pre_chorus",
      "section_label": "Pre-Chorus 1",
      "start_time": 45.8,
      "end_time": 60.5,
      "duration_seconds": 14.7,
      "start_beat": 55,
      "end_beat": 72,
      "mood": "building",
      "energy_level": "medium",
      "lyrics_line_refs": ["line_05", "line_06"],
      "lyrics_summary": "Emotional tension rises as the protagonist confronts the absence.",
      "visual_suggestion": "Camera movement intensifies, protagonist reaches a meaningful location, color temperature shifts warmer",
      "transition_to_next": "Hard cut on downbeat into chorus energy shift"
    },
    {
      "section_id": "chorus_1",
      "section_type": "chorus",
      "section_label": "Chorus 1",
      "start_time": 60.5,
      "end_time": 95.0,
      "duration_seconds": 34.5,
      "start_beat": 73,
      "end_beat": 114,
      "mood": "passionate",
      "energy_level": "high",
      "lyrics_line_refs": ["line_07", "line_08", "line_09", "line_10"],
      "lyrics_summary": "The hook expresses yearning and the bittersweet beauty of the remembered love.",
      "visual_suggestion": "Wide cinematic shots mixed with intense close-ups, performance intercut with narrative climax moments, rain as recurring motif",
      "transition_to_next": "Gentle deceleration back to intimate verse pacing"
    },
    {
      "section_id": "verse_2",
      "section_type": "verse",
      "section_label": "Verse 2",
      "start_time": 95.0,
      "end_time": 125.3,
      "duration_seconds": 30.3,
      "start_beat": 115,
      "end_beat": 150,
      "mood": "tender",
      "energy_level": "medium_low",
      "lyrics_line_refs": ["line_11", "line_12", "line_13", "line_14"],
      "lyrics_summary": "New details of the relationship surface, revealing what made it special.",
      "visual_suggestion": "Warmer color palette for memory sequences, intimate two-person compositions in recalled scenes",
      "transition_to_next": "Rhythmic cuts building energy toward chorus"
    },
    {
      "section_id": "chorus_2",
      "section_type": "chorus",
      "section_label": "Chorus 2",
      "start_time": 125.3,
      "end_time": 165.0,
      "duration_seconds": 39.7,
      "start_beat": 151,
      "end_beat": 198,
      "mood": "passionate",
      "energy_level": "high",
      "lyrics_line_refs": ["line_15", "line_16", "line_17", "line_18"],
      "lyrics_summary": "Repeated hook with deeper emotional commitment.",
      "visual_suggestion": "Parallel editing between present solitude and past togetherness, visual crescendo with light and motion",
      "transition_to_next": "Sudden drop into bridge stillness"
    },
    {
      "section_id": "bridge",
      "section_type": "bridge",
      "section_label": "Bridge",
      "start_time": 165.0,
      "end_time": 195.0,
      "duration_seconds": 30.0,
      "start_beat": 199,
      "end_beat": 234,
      "mood": "reflective",
      "energy_level": "medium",
      "lyrics_line_refs": ["line_19", "line_20"],
      "lyrics_summary": "A moment of acceptance and perspective shift.",
      "visual_suggestion": "Single long take or very slow cuts, protagonist reaches a turning point, dawn light begins to appear",
      "transition_to_next": "Build into final chorus through camera push-in"
    },
    {
      "section_id": "outro",
      "section_type": "outro",
      "section_label": "Outro",
      "start_time": 195.0,
      "end_time": 245.0,
      "duration_seconds": 50.0,
      "start_beat": 235,
      "end_beat": 294,
      "mood": "peaceful_resolution",
      "energy_level": "medium",
      "lyrics_line_refs": ["line_21", "line_22"],
      "lyrics_summary": "Final chorus fades into instrumental resolution.",
      "visual_suggestion": "Wide pullback shot revealing full scene, protagonist walks forward into morning light, gradual fade to black",
      "transition_to_next": "Fade to black"
    }
  ]
}
